{
  "behaviorChanges": true,
  "changes": [
    "Added one hour of the fixed Gaming Console (Xbox Series X + TV) activity to the Gen Z (no AI use) starter mix.",
    "Stored the existing fixed Xbox Series X plus reference television device context in that preset.",
    "Updated starter-mix provenance to distinguish the maintained gaming addition from the preset's underlying non-AI student scenario.",
    "Preserved every calculator coefficient, formula, source relationship, activity boundary, and historical v0.1.0 through v0.3.0 export."
  ],
  "collectionChanges": {
    "activities": {
      "added": [],
      "modified": [],
      "removed": []
    },
    "sources": {
      "added": [],
      "modified": [],
      "removed": []
    },
    "deviceProfiles": {
      "added": [],
      "modified": [],
      "removed": []
    },
    "presets": {
      "added": [],
      "modified": [
        "gen-z-no-ai"
      ],
      "removed": []
    },
    "methodSections": {
      "added": [],
      "modified": [
        "preset-notes"
      ],
      "removed": []
    },
    "externalComparisons": {
      "added": [],
      "modified": [],
      "removed": []
    }
  },
  "previousSchemaVersion": "0.3.0",
  "previousVersion": "0.3.0",
  "releasedOn": "2026-07-23",
  "schemaVersion": "0.3.0",
  "scientificImpact": "No calculator coefficients or formulas change. The release changes only one teaching starter mix by combining its existing non-AI student activity pattern with the separately documented fixed one-hour Xbox Series X plus television reference.",
  "summary": "Adds one hour of the existing fixed Xbox Series X plus television gaming reference to the Gen Z (no AI use) starter mix.",
  "version": "0.4.0"
}
